{
  "schema_version": "1.0.0",
  "generated_at": "2026-08-08",
  "evaluator": "Mongol AI correctness evaluator 1.0.0",
  "scope": "Unicode mechanics and locked-font behavior; not linguistic truth",
  "runtime": {
    "harfbuzz": "14.3.0",
    "font_sha256": "a28ba3cde3de22de7ddc934bd5d5babe54e6ce28c073a288cd978ffcf26b295b",
    "font_locked": true,
    "production_default_ignorables_preserved": false,
    "control_artifacts_suppressed_from_svg": true
  },
  "summary": {
    "task_count": 100,
    "by_verdict": {
      "machine_aligned": 48,
      "machine_conflict": 16,
      "machine_covered": 35,
      "needs_context": 1
    }
  },
  "results": [
    {
      "task_id": "s1-stdvar-001",
      "category": "standardized_variation_sequence",
      "method": "unicode-contextual-variant-response",
      "scope": "mechanical_standard_alignment_not_linguistic_truth",
      "desired_appearance": "second form",
      "probes": [
        {
          "context": "isolate",
          "expectation_class": "normative_target",
          "observed_change": true,
          "result": "aligned",
          "target_glyph_ids": [
            6
          ],
          "default_glyph_ids": [
            5
          ]
        },
        {
          "context": "initial",
          "expectation_class": "outside_declared_context",
          "observed_change": true,
          "result": "outside_declared_context",
          "target_glyph_ids": [
            9
          ],
          "default_glyph_ids": [
            8
          ]
        },
        {
          "context": "medial",
          "expectation_class": "normative_target",
          "observed_change": true,
          "result": "aligned",
          "target_glyph_ids": [
            11
          ],
          "default_glyph_ids": [
            10
          ]
        },
        {
          "context": "final",
          "expectation_class": "normative_target",
          "observed_change": true,
          "result": "aligned",
          "target_glyph_ids": [
            13
          ],
          "default_glyph_ids": [
            12
          ]
        }
      ],
      "score": 1,
      "verdict": "machine_aligned"
    },
    {
      "task_id": "s1-stdvar-002",
      "category": "standardized_variation_sequence",
      "method": "unicode-contextual-variant-response",
      "scope": "mechanical_standard_alignment_not_linguistic_truth",
      "desired_appearance": "third form",
      "probes": [
        {
          "context": "isolate",
          "expectation_class": "outside_declared_context",
          "observed_change": true,
          "result": "outside_declared_context",
          "target_glyph_ids": [
            7
          ],
          "default_glyph_ids": [
            5
          ]
        },
        {
          "context": "initial",
          "expectation_class": "outside_declared_context",
          "observed_change": false,
          "result": "outside_declared_context",
          "target_glyph_ids": [
            8
          ],
          "default_glyph_ids": [
            8
          ]
        },
        {
          "context": "medial",
          "expectation_class": "normative_target",
          "observed_change": false,
          "result": "missing_variant_response",
          "target_glyph_ids": [
            10
          ],
          "default_glyph_ids": [
            10
          ]
        },
        {
          "context": "final",
          "expectation_class": "outside_declared_context",
          "observed_change": false,
          "result": "outside_declared_context",
          "target_glyph_ids": [
            12
          ],
          "default_glyph_ids": [
            12
          ]
        }
      ],
      "score": 0,
      "verdict": "machine_conflict"
    },
    {
      "task_id": "s1-stdvar-003",
      "category": "standardized_variation_sequence",
      "method": "unicode-contextual-variant-response",
      "scope": "mechanical_standard_alignment_not_linguistic_truth",
      "desired_appearance": "second form",
      "probes": [
        {
          "context": "isolate",
          "expectation_class": "outside_declared_context",
          "observed_change": true,
          "result": "outside_declared_context",
          "target_glyph_ids": [
            15
          ],
          "default_glyph_ids": [
            14
          ]
        },
        {
          "context": "initial",
          "expectation_class": "normative_target",
          "observed_change": true,
          "result": "aligned",
          "target_glyph_ids": [
            17
          ],
          "default_glyph_ids": [
            16
          ]
        },
        {
          "context": "medial",
          "expectation_class": "outside_declared_context",
          "observed_change": false,
          "result": "outside_declared_context",
          "target_glyph_ids": [
            18
          ],
          "default_glyph_ids": [
            18
          ]
        },
        {
          "context": "final",
          "expectation_class": "normative_target",
          "observed_change": true,
          "result": "aligned",
          "target_glyph_ids": [
            20
          ],
          "default_glyph_ids": [
            19
          ]
        }
      ],
      "score": 1,
      "verdict": "machine_aligned"
    },
    {
      "task_id": "s1-stdvar-004",
      "category": "standardized_variation_sequence",
      "method": "unicode-contextual-variant-response",
      "scope": "mechanical_standard_alignment_not_linguistic_truth",
      "desired_appearance": "second form",
      "probes": [
        {
          "context": "isolate",
          "expectation_class": "outside_declared_context",
          "observed_change": true,
          "result": "outside_declared_context",
          "target_glyph_ids": [
            22
          ],
          "default_glyph_ids": [
            21
          ]
        },
        {
          "context": "initial",
          "expectation_class": "outside_declared_context",
          "observed_change": true,
          "result": "outside_declared_context",
          "target_glyph_ids": [
            25
          ],
          "default_glyph_ids": [
            24
          ]
        },
        {
          "context": "medial",
          "expectation_class": "normative_target",
          "observed_change": true,
          "result": "aligned",
          "target_glyph_ids": [
            27
          ],
          "default_glyph_ids": [
            26
          ]
        },
        {
          "context": "final",
          "expectation_class": "outside_declared_context",
          "observed_change": false,
          "result": "outside_declared_context",
          "target_glyph_ids": [
            29
          ],
          "default_glyph_ids": [
            29
          ]
        }
      ],
      "score": 1,
      "verdict": "machine_aligned"
    },
    {
      "task_id": "s1-stdvar-005",
      "category": "standardized_variation_sequence",
      "method": "unicode-contextual-variant-response",
      "scope": "mechanical_standard_alignment_not_linguistic_truth",
      "desired_appearance": "second form",
      "probes": [
        {
          "context": "isolate",
          "expectation_class": "outside_declared_context",
          "observed_change": false,
          "result": "outside_declared_context",
          "target_glyph_ids": [
            30
          ],
          "default_glyph_ids": [
            30
          ]
        },
        {
          "context": "initial",
          "expectation_class": "outside_declared_context",
          "observed_change": false,
          "result": "outside_declared_context",
          "target_glyph_ids": [
            31
          ],
          "default_glyph_ids": [
            31
          ]
        },
        {
          "context": "medial",
          "expectation_class": "normative_target",
          "observed_change": true,
          "result": "aligned",
          "target_glyph_ids": [
            33
          ],
          "default_glyph_ids": [
            32
          ]
        },
        {
          "context": "final",
          "expectation_class": "normative_target",
          "observed_change": true,
          "result": "aligned",
          "target_glyph_ids": [
            35
          ],
          "default_glyph_ids": [
            34
          ]
        }
      ],
      "score": 1,
      "verdict": "machine_aligned"
    },
    {
      "task_id": "s1-stdvar-006",
      "category": "standardized_variation_sequence",
      "method": "unicode-contextual-variant-response",
      "scope": "mechanical_standard_alignment_not_linguistic_truth",
      "desired_appearance": "second form",
      "probes": [
        {
          "context": "isolate",
          "expectation_class": "outside_declared_context",
          "observed_change": true,
          "result": "outside_declared_context",
          "target_glyph_ids": [
            37
          ],
          "default_glyph_ids": [
            36
          ]
        },
        {
          "context": "initial",
          "expectation_class": "outside_declared_context",
          "observed_change": true,
          "result": "outside_declared_context",
          "target_glyph_ids": [
            40
          ],
          "default_glyph_ids": [
            39
          ]
        },
        {
          "context": "medial",
          "expectation_class": "normative_target",
          "observed_change": true,
          "result": "aligned",
          "target_glyph_ids": [
            42
          ],
          "default_glyph_ids": [
            41
          ]
        },
        {
          "context": "final",
          "expectation_class": "outside_declared_context",
          "observed_change": true,
          "result": "outside_declared_context",
          "target_glyph_ids": [
            44
          ],
          "default_glyph_ids": [
            43
          ]
        }
      ],
      "score": 1,